### ISSUE TITLE
‘No Response’ in HomeKit

### ISSUE THREAD

**Issue by motogon** [hoobs-org/HOOBS#1312]
**Description**

devices used in hoobs ug ipad (after ios12.5.4 update) ‘No Response’ in HomeKit, leg devices connected directly to HomeKit are available.

How do I fix this problem?
Thank you

**Version**
3.3.5

**Did you upgrade**
Please let us know if you upgraded from a previous version.
- [ ] Yes
- [x] No

**Pervious version**
If you upgraded, please let us know your previous version.

**Did you orginally upgrade to HOOBS 3 from HOOBS 2.1.1?**
Did you perform an upgrade from HOOBS 2.1.1? Some things are different.
- [ ] Yes
- [x] No

**What device are you using?**
Please let us know the device you are running HOOBS on.
- [ ] HOOBS Box
- [ ] HOOBS SD Card
- [x] Custom Install

**If this is a custom install, what's your operating system?**

Ubuntu 20.04.2 LTS

**List your plugins**
https://plugins.hoobs.org/plugin/homebridge-mqtt
https://plugins.hoobs.org/plugin/homebridge-unifi-occupancy-sensor
https://plugins.hoobs.org/plugin/@milo526/homebridge-tuya-web
https://plugins.hoobs.org/plugin/homebridge-http-webhooks
https://plugins.hoobs.org/plugin/homebridge-haier-ac
https://plugins.hoobs.org/plugin/homebridge-camera-ui
https://plugins.hoobs.org/plugin/homebridge-plex-v2
https://plugins.hoobs.org/plugin/homebridge-dahua-alerts
https://plugins.hoobs.org/plugin/homebridge-ewelink

**Post your config**
This can be found in the interface, Configuration -> Advanced or you can get it via SSH `cat ~/.hoobs/etc/config.json`

* Remove any passwords from the config file. This is public.

```
{
    "server": {
        "port": 8888,
        "origin": "*",
        "autostart": 1,
        "home_setup_id": "X-HM://0023ISYWYL0CH",
        "polling_seconds": 5,
        "docker": false
    },
    "client": {
        "default_route": "status",
        "inactive_logoff": 30,
        "theme": "hoobs-dark",
        "locale": "ru",
        "temp_units": "celsius",
        "country_code": "RU",
        "postal_code": «*****»,
        "latitude": «***»,
        "longitude": «**»*
    },
    "bridge": {
        "name": "Lupanovo",
        "port": 51826,
        "pin": "031-45-154",
        "username": "CC:22:3D:E3:CE:40"
    },
    "description": "",
    "ports": {},
    "accessories": [
        {
            "accessory": "UniFi Occupancy Sensor",
            "plugin_map": {
                "plugin_name": "homebridge-unifi-occupancy-sensor",
                "index": 0
            },
            "name": "Я в Лупаново",
            "mode": "all",
            "interval": 1800,
            "unifi": {
                "site": "default",
                "controller": "https://192.168.3.20:8443",
                "username": «*»*,
                "password": «***»
            },
            "monitor": [
                {
                    "device": «****»
                },
                {
                    "device": «****9»
                }
            ]
        },
        {
            "accessory": "Plex",
            "name": "Plex Гостинная",
            "plex_token": «******»,
            "host": "192.168.1.153",
            "filter": [
                {
                    "user": «****»,
                    "player": "LG 65UK6450PLC"
                }
            ],
            "plugin_map": {
                "plugin_name": "homebridge-plex-v2",
                "index": 0
            }
        },
        {
            "accessory": "Plex",
            "name": "Plex Гостинная-1",
            "plex_token": «******»,
            "host": "192.168.1.101",
            "filter": [
                {
                    "user": «***»,
                    "player": "LG 65UK6450PLC"
                }
            ],
            "plugin_map": {
                "plugin_name": "homebridge-plex-v2",
                "index": 0
            }
        },
        {
            "accessory": "Plex",
            "name": "Plex кабинет",
            "plex_token": «******»,
            "host": "192.168.1.101",
            "filter": [
                {
                    "user": «*****»,
                    "player": "Chrome"
                }
            ],
            "plugin_map": {
                "plugin_name": "homebridge-plex-v2",
                "index": 0
            }
        },
        {
            "accessory": "HaierAC",
            "ip": "192.168.3.232",
            "mac": «*****»,
            "name": "Conditioner My Bedroom",
            "treatAutoHeatAs": "smart",
            "plugin_map": {
                "plugin_name": "homebridge-haier-ac",
                "index": 0
            }
        }
    ],
    "platforms": [
        {
            "name": "mqtt",
            "url": "mqtt://192.168.1.74",
            "port": "1883",
            "platform": "mqtt",
            "plugin_map": {
                "plugin_name": "homebridge-mqtt"
            }
        },
        {
            "platform": "TuyaWebPlatform",
            "plugin_map": {
                "plugin_name": "homebridge-tuya-web",
                "debug": true
            },
            "name": "TuyaWebPlatform",
            "scenes": false,
            "options": {
                "platform": "tuya",
                "username": «*»,
                "password": «*****»,
                "countryCode": "+7",
                "pollingInterval": 5
            }
        },
        {
            "platform": "eWeLink",
            "plugin_map": {
                "plugin_name": "homebridge-ewelink"
            },
            "name": "eWeLink",
            "debug": false,
            "debugReqRes": false,
            "sensorTimeLength": "2",
            "sensorTimeDifference": "120",
            "valveTimeLength": "20",
            "hideTHSwitch": false,
            "hideZBLDPress": false,
            "countryCode": "7",
            "username": «*****»,
            "password": «******»,
            "disableHTTPRefresh": false,
            "disablePlugin": false,
            "inUsePowerThreshold": 0,
            "lowBattThreshold": 25,
            "resetRFBridge": false
        },
        {
            "platform": "HttpWebHooks",
            "plugin_map": {
                "plugin_name": "homebridge-http-webhooks"
            },
            "webhook_port": "12346",
            "webhook_listen_host": "0.0.0.0",
            "sensors": [
                {
                    "id": "sensor2",
                    "name": "Sensor name 2",
                    "type": "motion",
                    "autoRelease": false,
                    "autoReleaseTime": 7500,
                    "debug": false
                }
            ]
        },
        {
            "platform": "dahua-alerts",
            "plugin_map": {
                "plugin_name": "homebridge-dahua-alerts"
            },
            "cameras": [
                {
                    "index": 7,
                    "cameraName": "Camera 8"
                }
            ],
            "host": "192.168.3.109",
            "user": «******»,
            "pass": «*******»,
            "homebridgeCameraFfmpegHttpPort": 4808
        },
        {
            "platform": "CameraUI",
            "plugin_map": {
                "plugin_name": "homebridge-camera-ui"
            },
            "name": "CameraUI",
            "auth": "form",
            "theme": "auto",
            "language": "ru",
            "debug": false,
            "reset": false,
            "mqtt": {
                "active": true,
                "host": "192.168.1.74",
                "port": 1883,
                "username": "mqtt",
                "topic": "homebridge/motion"
            },
            "http": {
                "active": true,
                "localhttp": true,
                "port": 4808
            },
            "ssl": {
                "active": false
            },
            "cameras": [
                {
                    "name": "Camera 1",
                    "motion": true,
                    "motionTimeout": 0,
                    "videoConfig": {
                        "source": "-rtsp_transport tcp -re -i rtsp://********@192.168.3.109:554/cam/realmonitor?channel=1&subtype=0",
                        "stillImageSource": "-rtsp_transport tcp -re -i rtsp://********@192.168.3.109:554/cam/realmonitor?channel=1&subtype=0",
                        "maxStreams": 2,
                        "vcodec": "h264",
                        "maxWidth": 1920,
                        "maxHeight": 1080,
                        "maxBitrate": 500,
                        "socketPort": 8101,
                        "maxFPS": 15,
                        "debug": false
                    }
                },
                {
                    "name": "Camera 2",
                    "motion": true,
                    "motionTimeout": 0,
                    "videoConfig": {
                        "source": "-rtsp_transport tcp -re -i rtsp://********@192.168.3.109:554/cam/realmonitor?channel=2&subtype=0",
                        "stillImageSource": "-rtsp_transport tcp -re -i rtsp://********@192.168.3.109:554/cam/realmonitor?channel=2&subtype=0",
                        "maxStreams": 2,
                        "vcodec": "h264",
                        "maxWidth": 1280,
                        "maxHeight": 720,
                        "maxBitrate": 500,
                        "socketPort": 8102,
                        "maxFPS": 15,
                        "debug": true
                    }
                },
                {
                    "name": "Camera 3",
                    "videoConfig": {
                        "source": "-rtsp_transport tcp -re -i rtsp://********@192.168.3.109:554/cam/realmonitor?channel=3&subtype=0",
                        "stillImageSource": "-rtsp_transport tcp -re -i rtsp://********@192.168.3.109:554/cam/realmonitor?channel=3&subtype=0",
                        "maxStreams": 2,
                        "vcodec": "h264",
                        "maxWidth": 1920,
                        "maxHeight": 1080,
                        "maxBitrate": 500,
                        "socketPort": 8103,
                        "maxFPS": 15,
                        "debug": false
                    }
                },
                {
                    "name": "Camera 4",
                    "videoConfig": {
                        "source": "-rtsp_transport tcp -re -i rtsp://********@192.168.3.109:554/cam/realmonitor?channel=4&subtype=0",
                        "stillImageSource": "-rtsp_transport tcp -re -i rtsp://********@192.168.3.109:554/cam/realmonitor?channel=4&subtype=0",
                        "maxStreams": 2,
                        "motion": true,
                        "motionTimeout": 0,
                        "vcodec": "h264",
                        "maxWidth": 1920,
                        "maxHeight": 1080,
                        "maxBitrate": 500,
                        "socketPort": 8104,
                        "maxFPS": 15,
                        "debug": false
                    }
                },
                {
                    "name": "Camera 5",
                    "videoConfig": {
                        "source": "-rtsp_transport tcp -re -i rtsp://********@192.168.3.109:554/cam/realmonitor?channel=5&subtype=0",
                        "stillImageSource": "-rtsp_transport tcp -re -i rtsp://********@192.168.3.109:554/cam/realmonitor?channel=5&subtype=0",
                        "maxStreams": 2,
                        "motion": true,
                        "motionTimeout": 0,
                        "vcodec": "h264",
                        "maxWidth": 1920,
                        "maxHeight": 1080,
                        "maxBitrate": 500,
                        "socketPort": 8105,
                        "maxFPS": 15,
                        "debug": false
                    }
                },
                {
                    "name": "Camera 6",
                    "motion": true,
                    "motionTimeout": 0,
                    "videoConfig": {
                        "source": "-rtsp_transport tcp -re -i rtsp://********@192.168.3.109:554/cam/realmonitor?channel=6&subtype=0",
                        "stillImageSource": "-rtsp_transport tcp -re -i rtsp://********@192.168.3.109:554/cam/realmonitor?channel=6&subtype=0",
                        "maxStreams": 2,
                        "vcodec": "h264",
                        "maxWidth": 1280,
                        "maxHeight": 720,
                        "maxBitrate": 500,
                        "socketPort": 8106,
                        "maxFPS": 15,
                        "debug": false
                    }
                },
                {
                    "name": "Camera 7",
                    "motion": true,
                    "motionTimeout": 10,
                    "videoConfig": {
                        "source": "-rtsp_transport tcp -re -i rtsp://********@192.168.3.109:554/cam/realmonitor?channel=7&subtype=0",
                        "stillImageSource": "-rtsp_transport tcp -re -i rtsp://********@192.168.3.109:554/cam/realmonitor?channel=7&subtype=0",
                        "maxStreams": 2,
                        "vcodec": "h264",
                        "maxWidth": 1920,
                        "maxHeight": 1080,
                        "maxBitrate": 500,
                        "socketPort": 8107,
                        "maxFPS": 15,
                        "debug": false
                    }
                },
                {
                    "name": "Camera 8",
                    "motion": true,
                    "motionTimeout": 10,
                    "videoConfig": {
                        "source": "-rtsp_transport tcp -re -i rtsp://********@192.168.3.109:554/cam/realmonitor?channel=8&subtype=0",
                        "stillImageSource": "-rtsp_transport tcp -re -i rtsp://********@192.168.3.109:554/cam/realmonitor?channel=8&subtype=0",
                        "maxStreams": 2,
                        "vcodec": "h264",
                        "maxWidth": 1280,
                        "maxHeight": 720,
                        "maxBitrate": 500,
                        "socketPort": 8108,
                        "maxFPS": 15,
                        "debug": false
                    }
                },
                {
                    "name": "Camera 9",
                    "motion": true,
                    "motionTimeout": 0,
                    "videoConfig": {
                        "source": "-rtsp_transport tcp -re -i rtsp://********@192.168.3.109:554/cam/realmonitor?channel=9&subtype=0",
                        "stillImageSource": "-rtsp_transport tcp -re -i rtsp://********@192.168.3.109:554/cam/realmonitor?channel=9&subtype=0",
                        "maxStreams": 2,
                        "vcodec": "h264",
                        "maxWidth": 1920,
                        "maxHeight": 1080,
                        "maxBitrate": 500,
                        "socketPort": 8109,
                        "maxFPS": 15,
                        "debug": false
                    }
                },
                {
                    "name": "Camera 10",
                    "motion": true,
                    "motionTimeout": 1,
                    "videoConfig": {
                        "source": "-rtsp_transport tcp -re -i rtsp://********@192.168.3.109:554/cam/realmonitor?channel=16&subtype=0",
                        "stillImageSource": "-rtsp_transport tcp -re -i rtsp://********@192.168.3.109:554/cam/realmonitor?channel=16&subtype=0",
                        "maxStreams": 2,
                        "vcodec": "h264",
                        "maxWidth": 1920,
                        "maxHeight": 1080,
                        "maxBitrate": 500,
                        "socketPort": 8110,
                        "maxFPS": 15,
                        "debug": false
                    }
                },
                {
                    "name": "Camera 11",
                    "motion": true,
                    "motionTimeout": 0,
                    "videoConfig": {
                        "source": "-rtsp_transport tcp -re -i rtsp://********@192.168.3.109:554/cam/realmonitor?channel=11&subtype=0",
                        "maxStreams": 2,
                        "vcodec": "h264",
                        "maxWidth": 1920,
                        "maxHeight": 1080,
                        "maxBitrate": 500,
                        "socketPort": 8111,
                        "audio": false,
                        "maxFPS": 15,
                        "debug": false
                    }
                },
                {
                    "name": "Camera 12",
                    "motion": true,
                    "motionTimeout": 0,
                    "videoConfig": {
                        "source": "-rtsp_transport tcp -re -i rtsp://********@192.168.3.109:554/cam/realmonitor?channel=12&subtype=0",
                        "stillImageSource": "-rtsp_transport tcp -re -i rtsp://********@192.168.3.109:554/cam/realmonitor?channel=12&subtype=0",
                        "maxStreams": 2,
                        "vcodec": "h264",
                        "maxWidth": 1920,
                        "maxHeight": 1080,
                        "maxBitrate": 500,
                        "socketPort": 8112,
                        "maxFPS": 15,
                        "debug": false
                    }
                },
                {
                    "name": "Camera 13",
                    "motion": true,
                    "motionTimeout": 0,
                    "videoConfig": {
                        "source": "-rtsp_transport tcp -re -i rtsp://********@192.168.3.109:554/cam/realmonitor?channel=13&subtype=0",
                        "stillImageSource": "-rtsp_transport tcp -re -i rtsp://********@192.168.3.109:554/cam/realmonitor?channel=13&subtype=0",
                        "maxStreams": 2,
                        "vcodec": "h264",
                        "maxWidth": 1920,
                        "maxHeight": 1080,
                        "maxBitrate": 500,
                        "socketPort": 8113,
                        "maxFPS": 15,
                        "debug": false
                    }
                },
                {
                    "name": "Camera 14",
                    "motion": true,
                    "motionTimeout": 0,
                    "videoConfig": {
                        "source": "-rtsp_transport tcp -re -i rtsp://********@192.168.3.109:554/cam/realmonitor?channel=14&subtype=0",
                        "stillImageSource": "-rtsp_transport tcp -re -i rtsp://********@192.168.3.109:554/cam/realmonitor?channel=14&subtype=0",
                        "maxStreams": 2,
                        "vcodec": "h264",
                        "maxWidth": 1280,
                        "maxHeight": 720,
                        "maxBitrate": 500,
                        "socketPort": 8114,
                        "maxFPS": 15,
                        "debug": false
                    }
                },
                {
                    "name": "Camera 15",
                    "motion": true,
                    "motionTimeout": 0,
                    "videoConfig": {
                        "source": "-rtsp_transport tcp -re -i rtsp://********@192.168.3.109:554/cam/realmonitor?channel=15&subtype=0",
                        "stillImageSource": "-rtsp_transport tcp -re -i rtsp://********@192.168.3.109:554/cam/realmonitor?channel=15&subtype=0",
                        "maxStreams": 2,
                        "vcodec": "h264",
                        "maxWidth": 1280,
                        "maxHeight": 720,
                        "maxBitrate": 500,
                        "socketPort": 8115,
                        "maxFPS": 15,
                        "debug": false
                    }
                }
            ],
            "options": {
                "videoProcessor": "ffmpeg",
                "interfaceName": "enp0s31f6"
            }
        }
    ]
}


```

**Post your log**

```
19:08:08.366643 IP 192.168.3.222 > 224.0.0.22: igmp v3 report, 1 group record(s)
19:08:08.511709 IP 192.168.3.222.5353 > 224.0.0.251.5353: 0*- [0q] 11/0/5 (Cache flush) TXT "si=5A50A2EC-DF38-4E71-B586-8C845852BB32", PTR _homekit._tcp.local., PTR 21303321-3049-591A-87C4-B619F587A09E._homekit._tcp.local., (Cache flush) SRV iPad.local.:49153 0 0, (Cache flush) TXT "rpHN=c0e1f5a89d55" "rpFl=0x30000" "rpVr=174.26" "rpHA=46769d28966f" "rpAD=3a943cd9a183" "rpHI=5dc03f9e7f9b" "rpBA=8E:5D:51:17:0A:E5", PTR _companion-link._tcp.local., PTR iPad._companion-link._tcp.local., TXT "model=J85mAP", (Cache flush) SRV iPad.local.:49220 0 0, (Cache flush) PTR iPad.local., (Cache flush) PTR iPad.local. (669)
19:08:10.339652 IP 192.168.3.222.5353 > 224.0.0.251.5353: 0 [2n] [1au] ANY (QU)? iPad.local. (101)
19:08:10.596236 IP 192.168.3.222.5353 > 224.0.0.251.5353: 0 [2n] [1au] ANY (QM)? iPad.local. (101)
19:08:10.700104 IP 192.168.3.222.5353 > 224.0.0.251.5353: 0*- [0q] 3/0/1 PTR 21303321-3049-591A-87C4-B619F587A09E._homekit._tcp.local., PTR iPad._companion-link._tcp.local., TXT "model=J85mAP" (189)
19:08:12.869145 IP 192.168.3.222.5353 > 224.0.0.251.5353: 0 [3q] [1au] PTR (QU)? _homekit._tcp.local. PTR (QU)? _companion-link._tcp.local. PTR (QU)? _sleep-proxy._udp.local. (112)
19:08:12.870219 IP 192.168.3.222.5353 > 224.0.0.251.5353: 0*- [0q] 2/0/3 (Cache flush) PTR iPad.local., (Cache flush) PTR iPad.local. (209)
19:08:13.041119 IP 192.168.3.222.5353 > 224.0.0.251.5353: 0 [6q] [2n] [1au] PTR (QU)? _hap._tcp.local. PTR (QU)? _homekit._tcp.local. PTR (QU)? _companion-link._tcp.local. TXT (QU)? E32FA431-D660-5778-82ED-56BAA8371B15._homekit._tcp.local. ANY (QU)? 21303321-3049-591A-87C4-B619F587A09E._homekit._tcp.local. ANY (QU)? iPad._companion-link._tcp.local. (241)
19:08:13.045033 IP 192.168.3.222.5353 > 224.0.0.251.5353: 0*- [0q] 1/0/1 PTR _homekit._tcp.local. (97)
19:08:13.290559 IP 192.168.3.222.5353 > 224.0.0.251.5353: 0 [2q] [2n] [1au] ANY (QM)? 21303321-3049-591A-87C4-B619F587A09E._homekit._tcp.local. ANY (QM)? iPad._companion-link._tcp.local. (175)
19:08:13.570728 IP 192.168.3.222.5353 > 224.0.0.251.5353: 0 [2q] [2n] [1au] ANY (QM)? 21303321-3049-591A-87C4-B619F587A09E._homekit._tcp.local. ANY (QM)? iPad._companion-link._tcp.local. (175)
19:08:13.819199 IP 192.168.3.222.5353 > 224.0.0.251.5353: 0 [2a] [5q] [1au] PTR (QM)? _hap._tcp.local. PTR (QM)? _homekit._tcp.local. PTR (QM)? _companion-link._tcp.local. TXT (QM)? E32FA431-D660-5778-82ED-56BAA8371B15._homekit._tcp.local. PTR (QM)? _sleep-proxy._udp.local. (224)
19:08:13.821162 IP 192.168.3.222.5353 > 224.0.0.251.5353: 0*- [0q] 5/0/3 PTR _homekit._tcp.local., PTR _companion-link._tcp.local., TXT "model=J85mAP", (Cache flush) PTR iPad.local., (Cache flush) PTR iPad.local. (333)
19:08:13.900008 IP 192.168.3.222.5353 > 224.0.0.251.5353: 0*- [0q] 7/0/3 (Cache flush) TXT "si=5A50A2EC-DF38-4E71-B586-8C845852BB32", PTR 21303321-3049-591A-87C4-B619F587A09E._homekit._tcp.local., (Cache flush) SRV iPad.local.:49153 0 0, (Cache flush) TXT "rpHN=c0e1f5a89d55" "rpFl=0x30000" "rpVr=174.26" "rpHA=46769d28966f" "rpAD=3a943cd9a183" "rpHI=5dc03f9e7f9b" "rpBA=8E:5D:51:17:0A:E5", PTR iPad._companion-link._tcp.local., TXT "model=J85mAP", (Cache flush) SRV iPad.local.:49220 0 0 (460)

```

**Additional context**
